{
  "$schema": "http://json-schema.org/draft-07/schema#",
  "$id": "https://djzs.ai/schemas/q3-record-1.1.json",
  "title": "DJZS Q3 record (protocol v1.1)",
  "description": "One narrative, bound to one objective resolution, audited once. Phase A fields are hashed before price lookup (phase_a_hash); Phase B adds price and seals (record_hash). outcome is outside both hashes.",
  "type": "object",
  "required": [
    "id",
    "protocol_version",
    "posted_at",
    "origin",
    "scan_ref",
    "source",
    "market",
    "binding",
    "prescreen",
    "intent",
    "criterion",
    "engine",
    "intent_sha256",
    "phase_a_hash"
  ],
  "properties": {
    "id": {
      "type": "string",
      "pattern": "^q3-\\d{4}-\\d{2}-\\d{2}-[A-Za-z0-9_-]+$"
    },
    "protocol_version": {
      "type": "string"
    },
    "posted_at": {
      "type": "string",
      "format": "date-time"
    },
    "origin": {
      "enum": [
        "scan",
        "pool"
      ]
    },
    "scan_ref": {
      "type": "string"
    },
    "supersedes": {
      "type": [
        "string",
        "null"
      ]
    },
    "deviated": {
      "type": "boolean"
    },
    "inclusion_note": {
      "type": [
        "string",
        "null"
      ]
    },
    "source": {
      "type": "object",
      "required": [
        "url",
        "text",
        "captured_at"
      ],
      "properties": {
        "url": {
          "type": "string"
        },
        "text": {
          "type": "string",
          "minLength": 1
        },
        "captured_at": {
          "type": "string",
          "format": "date-time"
        }
      }
    },
    "market": {
      "type": "object",
      "required": [
        "venue",
        "ticker",
        "side",
        "resolution_source",
        "resolution_due"
      ],
      "properties": {
        "venue": {
          "enum": [
            "kalshi",
            "polymarket",
            "series"
          ]
        },
        "ticker": {
          "type": "string"
        },
        "token_id": {
          "type": [
            "string",
            "null"
          ]
        },
        "title": {
          "type": "string"
        },
        "side": {
          "enum": [
            "YES",
            "NO"
          ]
        },
        "resolution_source": {
          "type": "string"
        },
        "resolution_due": {
          "type": "string",
          "format": "date-time"
        }
      }
    },
    "binding": {
      "type": "object",
      "required": [
        "type"
      ],
      "properties": {
        "type": {
          "enum": [
            "venue",
            "series",
            "unbound"
          ]
        },
        "series": {
          "type": [
            "string",
            "null"
          ]
        },
        "threshold": {
          "type": [
            "string",
            "null"
          ]
        },
        "at": {
          "type": [
            "string",
            "null"
          ]
        }
      }
    },
    "event_key": {
      "type": "string",
      "minLength": 1,
      "description": "v1.10, identifier clause corrected by v1.11. OPERATOR-ASSIGNED identifier for the real-world event this market resolves on, INDEPENDENT OF VENUE: resolving authority, the decision or measurement, and its scheduled date, in a form stable across venues and listings (e.g. FOMC-2026-09-16). \u00a76 clusters on this and never on venue_event_key. Sealed at Phase A. Not in `required` only because records sealed before v1.10 are immutable; q3-verify enforces it on every record posted on or after 2026-09-10."
    },
    "event_keys": {
      "description": "v1.13: present ONLY on a combination market \u2014 one that resolves jointly on more than one distinct real-world event. Two or more operator-assigned component keys, each satisfying v1.11. event_key must equal these entries sorted lexically and joined by '+'; that compound is a LABEL, not a cluster, and \u00a76 counts the record inside every component cluster instead. Absent on a single-event record; an array of fewer than two entries is invalid.",
      "type": "array",
      "minItems": 2,
      "uniqueItems": true,
      "items": {
        "type": "string",
        "minLength": 1
      }
    },
    "venue_event_key": {
      "type": [
        "string",
        "null"
      ],
      "description": "v1.11. The VENUE'S OWN published event identifier, verbatim where one exists and null where none does \u2014 e.g. a Kalshi event ticker or a Polymarket Gamma event slug. Kept so the venue's listing stays auditable; it is NEVER the clustering key. Sealed at Phase A. Required to be PRESENT (the key itself) on every record posted on or after 2026-09-10; its value may legitimately be null."
    },
    "thesis_state": {
      "type": [
        "string",
        "null"
      ],
      "enum": [
        "no_public_case",
        null
      ],
      "description": "v1.12. Present as \"no_public_case\" ONLY on a pooled market for which no dominant public case exists for either side. The protocol defines exactly this one value, so any other string is a typo rather than a new state; a record with a sourced thesis leaves the field absent or null. Such a record is primary-eligible and is NEVER deviated. Sealed at Phase A."
    },
    "search_record": {
      "type": [
        "object",
        "null"
      ],
      "description": "v1.12. Required and non-empty when thesis_state is \"no_public_case\": it evidences the absence rather than asserting it. Sealed at Phase A.",
      "properties": {
        "sources_consulted": {
          "type": "array",
          "minItems": 1,
          "items": {
            "type": "string"
          },
          "description": "The sources searched."
        },
        "queries": {
          "type": "array",
          "minItems": 1,
          "items": {
            "type": "string"
          },
          "description": "The queries used, verbatim."
        },
        "window": {
          "type": "object",
          "properties": {
            "from": {
              "type": "string"
            },
            "to": {
              "type": "string"
            }
          },
          "required": [
            "from",
            "to"
          ],
          "description": "The search window."
        },
        "searched_at": {
          "type": "string",
          "description": "When the search was run (ISO-8601 UTC)."
        }
      },
      "required": [
        "sources_consulted",
        "queries",
        "window",
        "searched_at"
      ]
    },
    "prescreen": {
      "type": "object",
      "required": [
        "codes",
        "sigma",
        "verdict",
        "by"
      ],
      "properties": {
        "codes": {
          "type": "array",
          "items": {
            "type": "string"
          }
        },
        "sigma": {
          "type": "number"
        },
        "verdict": {
          "enum": [
            "PASS",
            "WAIT",
            "FAIL",
            "OUT_OF_SCOPE"
          ]
        },
        "by": {
          "type": "string"
        }
      }
    },
    "intent": {
      "type": "object",
      "required": [
        "market",
        "side"
      ],
      "properties": {
        "market": {
          "type": "string"
        },
        "side": {
          "type": "string"
        },
        "thesis": {
          "description": "The verbatim dominant public case for the recorded side (\u00a73). NULL \u2014 and only null \u2014 when thesis_state is \"no_public_case\" (v1.12), which forbids writing, paraphrasing or reconstructing a thesis from the market's own question, price or structure.",
          "type": [
            "string",
            "null"
          ]
        },
        "probability_basis": {
          "description": "\u00a73: populated ONLY with text present in the source, quoted, and only where the source states a basis for the RECORDED side. Omitted otherwise.",
          "type": "string"
        },
        "size_usd": {
          "type": "number"
        },
        "bounds": {
          "type": "object"
        },
        "invalidation_condition": {
          "description": "\u00a73: populated ONLY with text present in the source, quoted \u2014 the falsification the source itself states. Omitted where the source states none, so the engine judges that absence.",
          "type": "string"
        }
      }
    },
    "intent_sha256": {
      "type": "string",
      "pattern": "^0x[0-9a-f]{64}$"
    },
    "intent_hash": {
      "type": [
        "string",
        "null"
      ],
      "pattern": "^0x[0-9a-f]{64}$"
    },
    "engine": {
      "type": "object",
      "required": [
        "verdict",
        "risk_score",
        "codes",
        "taxonomy",
        "in_scope"
      ],
      "properties": {
        "verdict": {
          "enum": [
            "PASS",
            "WAIT",
            "FAIL",
            "OUT_OF_SCOPE"
          ]
        },
        "action": {
          "type": "string"
        },
        "risk_score": {
          "type": "number"
        },
        "codes": {
          "type": "array",
          "items": {
            "type": "string"
          }
        },
        "unknown_fields": {
          "type": "array"
        },
        "verdict_hash": {
          "type": [
            "string",
            "null"
          ]
        },
        "taxonomy": {
          "type": "object",
          "required": [
            "pm",
            "engine",
            "extraction"
          ]
        },
        "eas_uid": {
          "type": [
            "string",
            "null"
          ]
        },
        "paid": {
          "type": "boolean"
        },
        "in_scope": {
          "type": "boolean"
        },
        "disagreements": {
          "type": "array"
        },
        "failsafe": {
          "type": "boolean"
        }
      }
    },
    "criterion": {
      "type": "object",
      "required": [
        "correct_if",
        "incorrect_if",
        "void_if",
        "grade_due"
      ],
      "properties": {
        "correct_if": {
          "type": "string"
        },
        "incorrect_if": {
          "type": "string"
        },
        "void_if": {
          "type": "string"
        },
        "grade_due": {
          "type": "string",
          "format": "date-time"
        }
      }
    },
    "phase_a_hash": {
      "type": "string",
      "pattern": "^0x[0-9a-f]{64}$"
    },
    "price_at_audit": {
      "type": [
        "number",
        "null"
      ],
      "minimum": 0,
      "maximum": 1
    },
    "implied_prob_at_audit": {
      "type": [
        "number",
        "null"
      ],
      "minimum": 0,
      "maximum": 1
    },
    "price_captured_at": {
      "type": [
        "string",
        "null"
      ]
    },
    "price_source": {
      "type": [
        "object",
        "null"
      ],
      "required": [
        "provider"
      ],
      "properties": {
        "provider": {
          "enum": [
            "dune",
            "operator"
          ]
        },
        "query_id": {
          "type": "integer"
        },
        "execution_id": {
          "type": "string"
        },
        "query_params": {
          "type": "object"
        },
        "vwap": {
          "type": "number"
        },
        "trade_count": {
          "type": "integer"
        },
        "volume_usdc": {
          "type": "number"
        },
        "window_start": {
          "type": "string"
        },
        "window_end": {
          "type": "string"
        },
        "note": {
          "type": "string"
        }
      }
    },
    "volume_24h": {
      "type": [
        "number",
        "null"
      ],
      "minimum": 0,
      "description": "v1.7(a): traded USD notional on the bound market in the 24h ending at posted_at. $1 of notional per contract (Kalshi) or per share (Polymarket) \u2014 the convention both venues publish and the \u00a73 pool ranks on. null for series bindings and for records sealed before v1.7."
    },
    "volume_total": {
      "type": [
        "number",
        "null"
      ],
      "minimum": 0,
      "description": "v1.7(a): cumulative traded USD notional on the bound market to posted_at, same $1-notional convention as volume_24h. Immutable once posted_at is past. null for series bindings and for records sealed before v1.7."
    },
    "record_hash": {
      "type": [
        "string",
        "null"
      ],
      "pattern": "^0x[0-9a-f]{64}$"
    },
    "outcome": {
      "type": [
        "object",
        "null"
      ],
      "required": [
        "result",
        "evidence_url",
        "graded_at",
        "grader"
      ],
      "properties": {
        "result": {
          "enum": [
            "CORRECT",
            "INCORRECT",
            "VOID"
          ]
        },
        "settled_value": {
          "type": [
            "string",
            "null"
          ]
        },
        "evidence_url": {
          "type": "string"
        },
        "graded_at": {
          "type": "string",
          "format": "date-time"
        },
        "grader": {
          "type": "string"
        },
        "note": {
          "type": [
            "string",
            "null"
          ]
        }
      }
    }
  }
}
