[
  {
    "id": "q3-2026-09-04-N1",
    "protocol_version": "1.3.1",
    "posted_at": "2026-09-04T16:00:00Z",
    "origin": "scan",
    "scan_ref": "2026-09-04_v2_governed_007 / N1",
    "supersedes": null,
    "deviated": false,
    "inclusion_note": "mirror of q3-2026-09-03-N1 on the same series, opposite side, different narrator; first audit of this narrative",
    "source": {
      "url": "https://finance.yahoo.com/markets/crypto/articles/bitcoin-news-today-price-tests-110811133.html",
      "text": "Fundstrat head of digital assets Sean Farrell called the move important data worth respecting, while noting Bitcoin has bucked its historically weak September pattern over the past three years.",
      "captured_at": "2026-09-04T15:45:00Z"
    },
    "market": {
      "venue": "series",
      "ticker": "COINBASE:BTC-USD",
      "title": "BTC Sep 30 close above Aug 31 close",
      "side": "YES",
      "resolution_source": "Coinbase BTC-USD daily close 2026-09-30 vs 2026-08-31",
      "resolution_due": "2026-10-01T00:00:00Z"
    },
    "binding": {
      "type": "series",
      "series": "COINBASE:BTC-USD",
      "threshold": "Sep 30 close > Aug 31 close",
      "at": "2026-10-01T00:00:00Z"
    },
    "prescreen": {
      "codes": [
        "DJZS-M02"
      ],
      "sigma": 30,
      "verdict": "WAIT",
      "by": "seat-prescreen"
    },
    "intent": {
      "market": "BTC September monthly close vs August",
      "side": "YES",
      "thesis": "Fundstrat head of digital assets Sean Farrell called the move important data worth respecting, while noting Bitcoin has bucked its historically weak September pattern over the past three years.",
      "size_usd": 250,
      "bounds": {
        "max_loss_usd": 250
      }
    },
    "criterion": {
      "correct_if": "Coinbase BTC-USD 2026-09-30 daily close is above the 2026-08-31 daily close.",
      "incorrect_if": "It is at or below.",
      "void_if": "Coinbase series unavailable for either date.",
      "grade_due": "2026-10-01T06:00:00Z"
    },
    "engine": {
      "verdict": "WAIT",
      "action": "WAIT",
      "risk_score": 0,
      "codes": [],
      "unknown_fields": [
        "invalidation_condition",
        "resolution_engagement",
        "probability_basis"
      ],
      "verdict_hash": "0xbcb928ece1aac4c2af5bcd56efb86ec20d6580227f9a4fa7dfc8ee5ea0307598",
      "taxonomy": {
        "pm": "DJZS-PM-v1.0",
        "engine": "DJZS-LF-v1.1",
        "extraction": "DJZS-X-v1.1"
      },
      "eas_uid": null,
      "paid": false,
      "in_scope": true,
      "disagreements": [
        "resolution_engagement",
        "probability_basis(evidence)"
      ],
      "failsafe": false
    },
    "intent_sha256": "0x240f90776722a8c9e44436577837fbcd7ab1e0829aaa1bfccce75ced2399c500",
    "intent_hash": "0x1d331ff2051535cf2ea12c11392a2211cac91c629bf6c7ae9526b8a42a124e32",
    "phase_a_hash": "0x9b207f326449c360e3b9986887922951a87f3e025b066e3f5b9d645513efdb6b",
    "price_at_audit": null,
    "implied_prob_at_audit": null,
    "price_captured_at": "2026-09-04T16:33:24.164Z",
    "record_hash": "0xb393fdfe3d61b835d9bad781c30891356a7b828562de6158e4afe7481608e75b",
    "outcome": null
  }
]
